{
  "accepted_evidence": {
    "content_hash": "sha256:4444444444444444444444444444444444444444444444444444444444444444",
    "kind": "text"
  },
  "actor": {"kind": "user"},
  "citation_id": "sha256:6666666666666666666666666666666666666666666666666666666666666666",
  "created_at": "2026-07-27T00:00:00Z",
  "event_id": "sha256:8888888888888888888888888888888888888888888888888888888888888888",
  "event_type": "citation.accepted",
  "previous_event_hash": "sha256:7777777777777777777777777777777777777777777777777777777777777777",
  "repository_id": "sha256:1111111111111111111111111111111111111111111111111111111111111111",
  "schema_version": "c2s.event.v0.3",
  "tool": {"name": "c2s", "version": "0.3.0"}
}
